Name,Price,Super,Link
"Arroz extra EROSKI basic, paquete 1 kg",0.79,eroski,https://supermercado.eroski.es/es/search/results/?q=arroz&suggestionsFilter=false
DIA ARROZONA arroz extra paquete 1 Kg,0.79,dia,https://www.dia.es/compra-online/search?text=arroz&x=0&y=0
"Arroz largo EROSKI BASIC, paquete 1 kg",0.9,eroski,https://supermercado.eroski.es/es/search/results/?q=arroz&suggestionsFilter=false
DIA ARROZONA arroz largo de 1ª categoría paquete 1 Kg,0.9,dia,https://www.dia.es/compra-online/search?text=arroz&x=0&y=0
"Vasitos de arroz basmati BRILLANTE, pack 2x125 g",1.15,eroski,https://supermercado.eroski.es/es/search/results/?q=arroz&suggestionsFilter=false
