Name,Super,Price,Link,product
DIA mermelada extra de albaricoque frasco 390 gr,dia,2.79,https://www.dia.es/compra-online/search?text=albaricoque&x=0&y=0,albaricoque
HELIOS mermelada de albaricoque extra frasco 340 gr,dia,4.85,https://www.dia.es/compra-online/search?text=albaricoque&x=0&y=0,albaricoque
DIA mermelada extra albaricoque frasco 650 gr,dia,2.54,https://www.dia.es/compra-online/search?text=albaricoque&x=0&y=0,albaricoque
HERO mermelada de albaricoque de temporada frasco 350 gr,dia,5.57,https://www.dia.es/compra-online/search?text=albaricoque&x=0&y=0,albaricoque
HERO Diet mermelada de albaricoque frasco 280 gr,dia,6.96,https://www.dia.es/compra-online/search?text=albaricoque&x=0&y=0,albaricoque
DIA yogur con albaricoque y mango vaso 200 gr,dia,2.45,https://www.dia.es/compra-online/search?text=albaricoque&x=0&y=0,albaricoque
DIA barritas de cereales con manzana y albaricoque estuche 150 gr,dia,7.67,https://www.dia.es/compra-online/search?text=albaricoque&x=0&y=0,albaricoque
DIA IMAQE Naturals limpiador facial exfoliante con hueso de albaricoque 50 gr,dia,65.80,https://www.dia.es/compra-online/search?text=albaricoque&x=0&y=0,albaricoque
DIA ZUMOSFERA bebida de frutas con leche melocotón y albaricoque pack 3 unidades 330 ml,dia,0.90,https://www.dia.es/compra-online/search?text=albaricoque&x=0&y=0,albaricoque
"Orejón y albaricoque EROSKI, tarrina 270 g",eroski,2.99,https://supermercado.eroski.es/es/search/results/?q=albaricoque&suggestionsFilter=false,albaricoque
"Orejones de albaricoque MEDINA, bolsa 150 g",eroski,11.07,https://supermercado.eroski.es/es/search/results/?q=albaricoque&suggestionsFilter=false,albaricoque
"Mermelada de albaricoque EROSKI basic, frasco 340 g",eroski,17.00,https://supermercado.eroski.es/es/search/results/?q=albaricoque&suggestionsFilter=false,albaricoque
"Yogur con fresas-albaricoque-pera-mora EROSKI, pack 8x125 g",eroski,2.38,https://supermercado.eroski.es/es/search/results/?q=albaricoque&suggestionsFilter=false,albaricoque
"Confitura de albaricoque HERO Diet, frasco 280 g",eroski,1.76,https://supermercado.eroski.es/es/search/results/?q=albaricoque&suggestionsFilter=false,albaricoque
"Mermelada de albaricoque BEBÉ, frasco 340 g",eroski,6.50,https://supermercado.eroski.es/es/search/results/?q=albaricoque&suggestionsFilter=false,albaricoque
"Mermelada de albaricoque LA VIEJA FABRICA, frasco 350 g",eroski,5.74,https://supermercado.eroski.es/es/search/results/?q=albaricoque&suggestionsFilter=false,albaricoque
"Mermelada de albaricoque HELIOS, frasco 340 g",eroski,6.29,https://supermercado.eroski.es/es/search/results/?q=albaricoque&suggestionsFilter=false,albaricoque
"Mermelada de albaricoque LA VIEJA FABRICA Diet, frasco 280 g",eroski,4.56,https://supermercado.eroski.es/es/search/results/?q=albaricoque&suggestionsFilter=false,albaricoque
"Mermelada de albaricoque diet EROSKI, frasco 290 g",eroski,7.50,https://supermercado.eroski.es/es/search/results/?q=albaricoque&suggestionsFilter=false,albaricoque
"Confitura de albaricoque BONNE MAMAN, frasco 370 g",eroski,4.48,https://supermercado.eroski.es/es/search/results/?q=albaricoque&suggestionsFilter=false,albaricoque
"Champú niño de albaricoque ULTRA SUAVE, bote 400 ml",eroski,6.46,https://supermercado.eroski.es/es/search/results/?q=albaricoque&suggestionsFilter=false,albaricoque
"Mermelada de albaricoque VERITAS, frasco 330 g",eroski,0.80,https://supermercado.eroski.es/es/search/results/?q=albaricoque&suggestionsFilter=false,albaricoque
"Mermelada de albaricoque HELIOS Diet, frasco 280 g",eroski,6.03,https://supermercado.eroski.es/es/search/results/?q=albaricoque&suggestionsFilter=false,albaricoque
